user_id|id|title|due_on|status
2626|1331|Amita thymbra cenaculum adultus est commodo capto qui tergum.|20220617|pending
2624|1330|Audax usitas taceo volup cibo subito brevis veritatis caritas.|20220524|pending
2623|1329|Calamitas coniuratio dolorem creator arx adulescens alii.|20220527|completed
2622|1328|Laboriosam adulatio turba usitas suadeo defero spoliatio tametsi.|20220525|pending
2613|1322|Curia agnosco capitulus corrupti succedo textus dolores consequatur sonitus somniculosus auris.|20220615|pending
2610|1320|Aeger dolore ulciscor conscendo amiculum corporis accusantium.|20220528|completed
2609|1319|Beatae utrimque confero vix provident aetas sordeo aestus demonstro claro nemo.|20220523|pending
2607|1318|Ipsum sumo deludo tamisium dolorem tredecim quo calco thesis ter demergo.|20220614|completed
2605|1317|Aspernatur thymbra aegre vorago complectus defero vallum.|20220520|pending
2603|1316|Apostolus suadeo illo praesentium bene libero id cauda calco error.|20220602|completed
2602|1315|Vitae triumphus ago talio aureus ater truculenter claustrum ulterius.|20220610|pending
2601|1314|Curatio tabgo dolores textus eos acies supellex desipio attollo.|20220603|completed
2595|1312|Creptio calculus consectetur sollicito cupio utique venio conturbo.|20220602|completed
2593|1310|Vicinus enim caritas cavus coadunatio et asper quis.|20220528|completed
2591|1308|Ad cilicium debilito eius administratio.|20220611|completed
2587|1304|Despirmatio credo cometes comminor repellendus.|20220530|completed
2582|1300|Comparo tumultus subiungo currus ademptio.|20220608|pending
2581|1299|Caste vilicus demulceo terga stipes.|20220521|completed
2572|1292|Crux quia pecus verbum cogito velit coniecto defessus villa magnam.|20220607|pending
2564|1289|Defungo ventosus asperiores non dapifer succurro unde thesaurus tripudio et corrumpo.|20220608|completed
